question,answer
What is ProcUrPal?,ProcUrPal is an AI-powered ProcureTech startup revolutionizing the Procurement SaaS market.
Who founded ProcUrPal?,ProcUrPal was founded by Vikas Chadda.
"What is the background of Vikas Chadda, the founder?","Vikas Chadda is an industry veteran with over 25 years of experience in IT infrastructure, handling large RFPs, government procurement, and SaaS."
How is ProcUrPal officially recognized?,ProcUrPal is recognized as a startup by the DPIIT (Department for Promotion of Industry and Internal Trade).
What certification does ProcUrPal hold regarding security?,"ProcUrPal holds the ISO 27001 certification, demonstrating commitment to information security and governance."
What award did ProcUrPal win from Business Connect Magazine in 2024?,ProcUrPal received the 'Innovative Leaders of The Year 2024 Award' from Business Connect Magazine.
What recognition did ProcUrPal receive at the India AI Summit 2024?,ProcUrPal was awarded the 'Best Use of AI in Procurement & SaaS' at the India AI Summit 2024.
What is ProcUrPal's mission?,"To revolutionize procurement by providing innovative, AI-powered solutions that streamline processes, optimize supplier relationships, and drive tangible value for businesses worldwide."
What is the main focus of ProcUrPal's mission?,The mission is to revolutionize the procurement landscape through AI-powered solutions.
Does ProcUrPal operate only in India?,"No, ProcUrPal empowers businesses in India and worldwide."
Is ProcUrPal a SaaS company?,"Yes, ProcUrPal is redefining and revolutionizing the Procurement SaaS market."
What are the main solutions offered by ProcUrPal?,"ProcUrPal offers the RFx Module, eAuction Module, Tail Spend Management, and Consulting Services."
Tell me about the RFx module.,"ProcUrPal's RFx module automates and simplifies RFIs, RFPs, and RFQs."
What kind of events does the RFx module streamline?,"The RFx module streamlines sourcing events like RFIs, RFPs, and RFQs."
Does the RFx module support AI scoring?,"Yes, the RFx module includes AI-enabled scoring."
Can I use templates in the RFx module?,"Yes, the RFx module offers standardized templates and comprehensive question libraries."
Does the RFx module have automated workflows?,"Yes, the RFx module includes automated workflows."
How much time can the RFx module save?,The RFx process can be sped up by over 50% using the RFx module.
What is the eAuction module used for?,The eAuction module is used to drive significant savings and optimize supplier selection through real-time negotiations.
What auction types are supported by the eAuction module?,"Supported e-auction types include Reverse Auction (rank based), Forward Auction, Dutch Auction, and English Auction."
What features are available in the eAuction module?,"Features include supplier recommendations, AI Bot Support, automated alerts, and supplier bids side-by-side comparison."
What kind of savings can I expect from the eAuction module?,You can derive at least 20% overall savings on your project budget with the eAuction module.
Explain Tail Spend Management.,"Tail spend management helps control frequent, low-value purchases that often go unmanaged."
Why is it important to manage tail spend?,"Untracked tail spend can cause inefficiencies like duplicate buying, inefficient supplier management, missed discounts, and compliance risks."
What percentage of indirect expenses is typically tail spend?,Tail spend can make up over 10% of indirect expenses.
How does ProcUrPal help control tail spend?,"ProcUrPal helps control tail spend using automation tools for better visibility, among other methods."
What are ProcUrPal's Consulting Services?,"Consulting Services include automating procurement, enhancing supplier collaboration, cutting costs, and implementing strategic procurement practices."
How much can Consulting Services reduce SG&A costs?,Consulting Services can cut SG&A costs by up to 20% using AI and RPA.
What kind of savings do digital procurement solutions drive through Consulting?,Digital procurement solutions drive 30-40% savings through P2P automation and AI-driven category management.
What makes ProcUrPal unique?,ProcUrPal simplifies and streamlines the procurement process with several key USPs.
What are the key benefits of the ProcUrPal platform?,"Key benefits include an End-to-End Procurement Suite, AI-Powered Analytics, a User-Friendly Interface, Cost-Effectiveness, and Scalability."
Does ProcUrPal cover the entire procurement process?,"Yes, the End-to-End Procurement Suite covers all stages from sourcing to contract management and supplier performance."
How does ProcUrPal leverage AI?,ProcUrPal utilizes AI-Powered Analytics to optimize procurement decisions and identify cost-saving opportunities.
Is the ProcUrPal interface easy for procurement professionals?,"Yes, it is designed with a User-Friendly Interface for efficient navigation."
Is ProcUrPal affordable for businesses?,"Yes, it is Cost-Effective, offering affordable pricing plans for businesses of all sizes."
Can I access ProcUrPal from anywhere?,"Yes, as a Cloud-Based Solution, it provides flexibility and accessibility from anywhere, anytime."
Does ProcUrPal allow customization for specific needs?,"Yes, the platform allows for Customization to adapt to specific business requirements."
How does the platform improve working with suppliers?,"It facilitates better Supplier Collaboration, improving transparency and efficiency."
Can I see procurement data in real-time?,"Yes, ProcUrPal provides Real-Time Analytics and reporting capabilities."
Does ProcUrPal help manage compliance?,"Yes, it helps organizations maintain Compliance Management with procurement regulations and policies."
Can ProcUrPal connect with my existing systems?,"Yes, it offers seamless Integration Capabilities with existing ERP systems."
Is ProcUrPal suitable for large businesses with complex needs?,"Yes, it is built for Scalability, accommodating the complexities of large enterprises and multi-site operations."
Does ProcUrPal offer visibility into procurement?,"Yes, ProcUrPal ensures real-time visibility into procurement processes for Transparency."
What pricing models does ProcUrPal offer?,"ProcUrPal offers three main pricing models: Subscription Model, Event-Based Pricing, and Spend-Based Pricing."
Which pricing model is recommended for large enterprises needing full automation?,The Subscription Model is recommended for Enterprises looking for end-to-end procurement automation.
What type of plans are available with the Subscription Model?,The Subscription Model offers Fixed Quarterly or annual plans.
What features are included in the Subscription Model?,"Features include AI-driven insights, RFQs, eAuctions, and supplier management."
Who is Event-Based Pricing suitable for?,Event-Based Pricing is suitable for Small and Mid-Sized companies & Project-Based Buyers needing flexibility.
How does Event-Based Pricing work?,"With Event-Based Pricing, you pay only the deployment cost and pay only for what you use as per the events slab."
When is Event-Based Pricing ideal?,It's perfect for one-time procurement events or seasonal purchasing.
Which pricing model is best for large companies with high procurement volume?,Spend-Based Pricing is best for Large Enterprises handling high-value procurement.
How is the fee calculated in the Spend-Based Pricing model?,It is a Transparent percentage-based fee on total procurement spend.
Does the Spend-Based fee change?,The fee scales with your business – offering higher savings as volume grows.
How can I find out which pricing model is right for me?,ProcUrPal offers a pricing model that aligns with your procurement strategy; you can Contact Us to discuss options.
Can I get a quote for ProcUrPal pricing?,"Yes, you need to Contact Us to get specific pricing details based on your needs."
How much can using ProcUrPal reduce procurement costs?,You can reduce procurement costs by up to 20% with smarter sourcing.
How quickly can ProcUrPal help with supplier negotiations?,ProcUrPal can cut supplier negotiation time by 50% with AI-driven insights.
Does ProcUrPal help ensure compliance?,"Yes, ProcUrPal helps ensure 100% compliance & transparency with automated workflows."
How can I contact ProcUrPal?,"You can contact ProcUrPal via phone or email, or find their address."
What is the main phone number for ProcUrPal?,The phone number is +91 91634 00786.
What is the main email address for ProcUrPal inquiries?,The email address is vikas@procurpal.in.
What is the physical address of ProcUrPal Private Limited?,"The address is ProUrPal Private Limited, Obeya Verve, L376 / A, 14th B Cross Rd, Sector 6, HSR Layout, Bengaluru, Karnataka 560102, India."
In which city is ProcUrPal located?,ProcUrPal is located in Bengaluru.
In which state is ProcUrPal located?,ProcUrPal is located in Karnataka.
What is the pincode for the ProcUrPal address?,The pincode is 560102.
What road is the ProcUrPal office on?,"The office is on 14th B Cross Rd, Sector 6, HSR Layout."
Does ProcUrPal have a presence on social media?,"Yes, ProcUrPal is present on social media."
Where can I find ProcUrPal on social media?,"You can find ProcUrPal on LinkedIn (ProcUrPal, Vikas Chadda) and YouTube (@procurpal.in)."
Can I send an email to ProcUrPal?,"Yes, you can send an email to vikas@procurpal.in."
How can I get in touch with ProcUrPal sales?,"You can use the provided phone number or email address, or the 'Contact Us' option on the website to get in touch with ProcUrPal."
How can I reach ProcUrPal support?,You can use the provided phone number (+91 91634 00786) or email address (vikas@procurpal.in) for assistance.
How do I create a purchase order in ProcUrPal?,"You can create a purchase order through the ProcUrPal platform using its sourcing and procurement tools, integrated into the P2P process."
Can I track the status of purchase orders in ProcUrPal?,"Yes, the platform provides real-time tracking and analytics for all procurement activities including purchase orders."
Does ProcUrPal offer purchase order approval workflows?,"Yes, ProcUrPal supports customizable automated workflows including PO approval processes."
Can I generate reports specifically for purchase orders?,"Yes, ProcUrPal offers reporting and analytics tools for tracking and auditing purchase orders."
Does ProcUrPal manage the process from requisition to payment?,"Yes, digital procurement solutions drive savings through P2P automation, which covers the process from requisition to payment."
Is goods receipt handled within ProcUrPal related to POs?,"Yes, as part of P2P automation, steps like goods receipt related to purchase orders are managed within the platform."
Does ProcUrPal help with matching invoices to purchase orders?,"Yes, P2P automation typically includes invoice processing and matching against purchase orders."
Can ProcUrPal integrate with my accounting system for POs?,"Yes, ProcUrPal offers seamless ERP integration which can include connecting with accounting systems for managing purchase orders and payments."
How are purchase order workflows automated?,"ProcUrPal supports customizable automated workflows, allowing you to automate steps like purchase order generation and approval."
Can the RFx module lead to generating a purchase order?,"While the RFx module focuses on sourcing, the platform's integration and P2P capabilities can facilitate purchase order creation after supplier selection."
Does tail spend management involve using purchase orders?,"Yes, tail spend management involves controlling frequent purchases which are typically managed and tracked through the platform's tools and integrated P2P processes, including POs."
Can I track budgets against purchase orders in ProcUrPal?,"Yes, the platform's real-time analytics and transparency features allow you to track budget consumption related to procurement activities like purchase orders."
What can you help me with?,"I can assist with questions about ProcUrPal, its services, modules, pricing, and procurement best practices mentioned on the website."
How secure is ProcUrPal?,"ProcUrPal is ISO 27001 certified, ensuring high standards of information security and governance."
Is ProcUrPal suitable for small businesses?,"Yes, ProcUrPal offers scalable and flexible pricing suitable for businesses of all sizes, including SMBs and project-based buyers, particularly with the Event-Based pricing."
Can ProcUrPal integrate with ERP systems?,"Yes, ProcUrPal seamlessly integrates with major ERP systems to automate procurement processes."
How can I get a demonstration of the ProcUrPal platform?,You can likely click the 'Get Started' button on the website or Contact Us to arrange a demonstration.
Where can I find more information or resources about ProcUrPal?,"You can find Resources like Blogs, Case Studies, and In Media on the ProcUrPal website."
What kind of customer support is available?,You can contact ProcUrPal via the provided phone number or email address for support and assistance.
How does ProcUrPal contribute to digital transformation?,ProcUrPal helps organizations achieve their digital transformation goals through cutting-edge SAAS platform that streamlines processes.
Is ProcUrPal suitable for global operations?,"Yes, the platform is designed to empower businesses worldwide and is built to scale with multi-site operations."
Can I partner with ProcUrPal?,"Yes, there is a 'Partner With Us' option mentioned on the website."
How can I become a ProcUrPal partner?,You can find information or contact them via the 'Partner With Us' link/page on the website.
Does ProcUrPal help with ESG compliance?,"Yes, Consulting Services include ESG-compliant strategies to build resilient supply chains."
What is zero-based budgeting in the context of ProcUrPal?,ProcUrPal helps unlock hidden efficiencies through zero-based budgeting as part of its Consulting Services.
What is value chain analysis in the context of ProcUrPal?,ProcUrPal assists with value chain analysis as part of its Consulting Services to unlock hidden efficiencies.
